{
  "schema_version": "lazyseries.completion-evidence.v1",
  "run_id": "minimal-run",
  "task_id": "task-cost-comparison",
  "criterion_id": "criterion-cost-comparison",
  "repo_head": "aaaaaaaaaaaaaaaaaaaaaaaaaaaaaaaaaaaaaaaa",
  "package_version": "1.3.1",
  "command": "node --test verification.js",
  "exit_code": 0,
  "started_at": "2026-09-19T00:00:00Z",
  "finished_at": "2026-09-19T00:00:01Z",
  "artifact": { "path": "artifacts/criterion.log", "sha256": "e7d3d49bdb106033b33121050b055c28fdf817fdbbca19c87a85c6009db5c5f9" },
  "executor": { "identity": "agent/executor-1" },
  "verifier": { "identity": "agent/verifier-1" },
  "review": { "verdict": "approved", "source_sha256": "bbbbbbbbbbbbbbbbbbbbbbbbbbbbbbbbbbbbbbbbbbbbbbbbbbbbbbbbbbbbbbbb" }
}
